{
  "description": "Plugin submits the signed proof; the server's own callback to the site's challenge endpoint also succeeds, so verified is true.",
  "http": {"method": "POST", "path": "/v1/sites/st_3f9c2a1b7e4d/verify"},
  "schema": {"request": "schemas/sites.verify.request.schema.json", "response": "schemas/sites.verify.response.schema.json"},
  "setup": {
    "sites": [
      {
        "id": "st_3f9c2a1b7e4d",
        "host": "example.org",
        "home_url": "https://example.org",
        "verified": false,
        "license_kind": "free",
        "license_status": "active",
        "quota": {
          "free_slots": {"theme": {"used": 0, "limit": 1}, "plugin": {"used": 0, "limit": 2}},
          "downloads": {"used": 0, "limit": 500, "period": "daily"}
        }
      }
    ],
    "note": "the server's callback to https://example.org/wp-json/babilim/v1/challenge?nonce=... succeeds and returns a matching proof"
  },
  "stable_fields": ["/verified", "/license", "/quota"],
  "request": {
    "headers": {
      "Content-Type": "application/json",
      "User-Agent": "Babilim/1.3.0; https://example.org"
    },
    "body": {
      "nonce": "9c2a1b7e4d3f6b8c1e4a7d0f3b6c9e2a",
      "proof": "b64:Oczz1Urizyn++RSrwdKCPK0Eu6Vt2phmu9TRQkTmxHS82WBW3UpKApanqpoVWgoKoNHz+Ho64A7qsyUAJ4xaBw=="
    }
  },
  "response": {
    "status": 200,
    "body": {
      "site_token": "tok_7a0d3f6b8c1e4a7d0f3b6c9e2a5d8f1b",
      "verified": true,
      "license": {"kind": "free", "status": "active"},
      "quota": {
        "free_slots": {"theme": {"used": 0, "limit": 1}, "plugin": {"used": 0, "limit": 2}},
        "downloads": {"used": 0, "limit": 500, "period": "daily"}
      }
    }
  }
}
