{
  "description": "Site rotates its token (e.g. after a suspected leak). The old token stops working immediately.",
  "http": {"method": "POST", "path": "/v1/sites/st_3f9c2a1b7e4d/rotate-token"},
  "schema": {"request": "schemas/sites.rotate-token.request.schema.json", "response": "schemas/sites.rotate-token.response.schema.json"},
  "setup": {
    "sites": [
      {
        "id": "st_3f9c2a1b7e4d",
        "host": "example.org",
        "token": "tok_7a0d3f6b8c1e4a7d0f3b6c9e2a5d8f1b",
        "verified": true,
        "license_kind": "free",
        "license_status": "active"
      }
    ]
  },
  "stable_fields": [],
  "request": {
    "headers": {
      "Authorization": "Bearer tok_7a0d3f6b8c1e4a7d0f3b6c9e2a5d8f1b",
      "User-Agent": "Babilim/1.3.0; https://example.org"
    },
    "body": {}
  },
  "response": {
    "status": 200,
    "body": {
      "site_token": "tok_c5e8a1d4f7b5f2b1c9e7a0d3f6b8c1e4",
      "rotated_at": "2026-09-27T12:20:00Z"
    }
  }
}
