{
  "description": "Plugin registers a fresh site and receives a challenge to answer.",
  "http": {"method": "POST", "path": "/v1/sites"},
  "schema": {"request": "schemas/sites.register.request.schema.json", "response": "schemas/sites.register.response.schema.json"},
  "setup": {"note": "no prior state; this is the site's first ever registration"},
  "stable_fields": [],
  "request": {
    "headers": {
      "Content-Type": "application/json",
      "User-Agent": "Babilim/1.3.0; https://example.org"
    },
    "body": {
      "home_url": "https://example.org",
      "wp_version": "6.7.1",
      "php_version": "8.2.15",
      "plugin_version": "1.3.0",
      "site_locale": "de_DE",
      "locales": ["de_DE", "fr_FR"],
      "install_pub": "MCowBQYDK2VwAyEAsd0BmOU2NlYeqB+9JOeto6JBxr9ngJbKJA0Gmae16m4="
    }
  },
  "response": {
    "status": 201,
    "body": {
      "site_id": "st_3f9c2a1b7e4d",
      "challenge": {
        "nonce": "9c2a1b7e4d3f6b8c1e4a7d0f3b6c9e2a",
        "expires_at": "2026-09-27T12:15:00Z"
      }
    }
  }
}
