{
  "description": "Site is on the free tier and has already bound its 2 free plugin slots to other components; this download would exceed the free quota.",
  "http": {
    "method": "POST",
    "path": "/v1/downloads"
  },
  "schema": {
    "request": "schemas/downloads.request.schema.json",
    "response": "schemas/_error.schema.json"
  },
  "setup": {
    "sites": [
      {
        "id": "st_3f9c2a1b7e4d",
        "token": "tok_7a0d3f6b8c1e4a7d0f3b6c9e2a5d8f1b",
        "verified": true,
        "license_kind": "free",
        "license_status": "active",
        "quota": {
          "free_slots": {
            "theme": {
              "used": 0,
              "limit": 1
            },
            "plugin": {
              "used": 2,
              "limit": 2
            }
          },
          "downloads": {
            "used": 5,
            "limit": 500,
            "period": "daily"
          }
        }
      }
    ],
    "slot_bindings": [
      {
        "site_id": "st_3f9c2a1b7e4d",
        "kind": "plugin",
        "slug": "component-a"
      },
      {
        "site_id": "st_3f9c2a1b7e4d",
        "kind": "plugin",
        "slug": "component-f"
      }
    ],
    "builds": [
      {
        "id": "bd_1c9e7a0d3f6b",
        "kind": "plugin",
        "slug": "component-x",
        "version": "1.0.0",
        "locale": "de_DE",
        "build_no": 1,
        "active": true
      }
    ],
    "wporg_registry": [
      {
        "kind": "plugin",
        "slug": "component-x",
        "state": "verified_wporg",
        "versions": [
          "1.0.0"
        ],
        "stable_version": "1.0.0"
      }
    ]
  },
  "stable_fields": [
    "/error/code"
  ],
  "request": {
    "headers": {
      "Authorization": "Bearer tok_7a0d3f6b8c1e4a7d0f3b6c9e2a5d8f1b",
      "Content-Type": "application/json",
      "User-Agent": "Babilim/1.3.0; https://example.org"
    },
    "body": {
      "build_id": "bd_1c9e7a0d3f6b"
    }
  },
  "response": {
    "status": 403,
    "body": {
      "error": {
        "code": "quota_exceeded",
        "message": "Free plugin slots are full for this site.",
        "hint": "Upgrade to a paid license to download language packs for additional components."
      }
    }
  }
}
