{
  "description": "build_id refers to a build the operator has deactivated (or an id that never existed); nothing to redirect to.",
  "http": {"method": "POST", "path": "/v1/downloads"},
  "schema": {"request": "schemas/downloads.request.schema.json", "response": "schemas/_error.schema.json"},
  "setup": {
    "sites": [
      {"id": "st_3f9c2a1b7e4d", "token": "tok_7a0d3f6b8c1e4a7d0f3b6c9e2a5d8f1b", "verified": true, "license_kind": "free", "license_status": "active"}
    ],
    "builds": [
      {"id": "bd_deadbeefdead", "kind": "plugin", "slug": "component-x", "version": "9.9.9", "locale": "de_DE", "build_no": 5, "active": false}
    ]
  },
  "stable_fields": ["/error/code"],
  "request": {
    "headers": {
      "Authorization": "Bearer tok_7a0d3f6b8c1e4a7d0f3b6c9e2a5d8f1b",
      "Content-Type": "application/json",
      "User-Agent": "Babilim/1.3.0; https://example.org"
    },
    "body": {"build_id": "bd_deadbeefdead"}
  },
  "response": {
    "status": 404,
    "body": {
      "error": {
        "code": "not_available",
        "message": "This build is not available for download.",
        "hint": ""
      }
    }
  }
}
